{
  "event_id": "evt-conflict-a",
  "timestamp": "2026-09-20T18:10:00Z",
  "actor": {
    "id": "NC-Arch",
    "type": "agent",
    "session_id": "sess-003"
  },
  "run_id": "run-conflict-a",
  "phase": "NC-Arch",
  "action": "reserve_graph_scope",
  "scope": {
    "files": [
      "specs/008-bootstrap-governance-hardening/graph.yaml"
    ],
    "directories": [
      "specs/008-bootstrap-governance-hardening"
    ],
    "lock_id": "lock-graph-001"
  },
  "artifacts_produced": [],
  "decision": "pending",
  "retry_count": 0,
  "approval": {
    "required": true,
    "status": "pending",
    "approved_by": null,
    "approved_at": null,
    "gate_id": "governance-complexity-gate"
  },
  "final_result": "partial",
  "failure_reason": null,
  "notes": "lock inicial"
}
